{
	"$schema": "../theme.schema.json",
	"schemaVersion": 2,
	"id": "high-contrast-light",
	"label": "High Contrast Light",
	"order": 60,
	"appearance": "light",
	"contrast": "high",
	"colors": {
		"accent": "#0b0b0b",
		"accentHover": "#30302e",
		"accentSolid": "#0b0b0b",
		"onAccent": "#ffffff",
		"bubbleAccent": "#52514e",
		"background": "#ffffff",
		"header": "#ffffff",
		"content": "#fcfcfb",
		"sidebar": "#f9f9f7",
		"input": "#ffffff",
		"elevated": "#ffffff",
		"hover": "#dfdfda",
		"border": "#898781",
		"borderStrong": "#52514e",
		"text": "#0b0b0b",
		"muted": "#343430",
		"hint": "#5e5d58",
		"selection": "#0b0b0b",
		"selectionForeground": "#ffffff",
		"editorSelection": "#0b0b0b",
		"editorSelectionForeground": "#ffffff",
		"info": "#006bbd",
		"success": "#116329",
		"danger": "#b5200d",
		"dangerHover": "#9f1c0b",
		"onDanger": "#ffffff",
		"warning": "#855900"
	},
	"ansi": {
		"black": "#000000",
		"red": "#cd3131",
		"green": "#00bc00",
		"yellow": "#949800",
		"blue": "#0451a5",
		"magenta": "#bc05bc",
		"cyan": "#0598bc",
		"white": "#555555",
		"brightBlack": "#666666",
		"brightRed": "#cd3131",
		"brightGreen": "#14ce14",
		"brightYellow": "#b5ba00",
		"brightBlue": "#0451a5",
		"brightMagenta": "#bc05bc",
		"brightCyan": "#0598bc",
		"brightWhite": "#a5a5a5"
	},
	"syntax": {
		"foreground": "#292929",
		"comment": "#515151",
		"commentDoc": "#515151",
		"keyword": "#a0111f",
		"string": "#032563",
		"number": "#023b95",
		"regexp": "#032563",
		"annotation": "#622cbc",
		"tag": "#024c1a",
		"attributeName": "#023b95",
		"attributeValue": "#032563",
		"property": "#023b95",
		"function": "#622cbc",
		"type": "#702c00",
		"variable": "#702c00",
		"constant": "#023b95",
		"operator": "#a0111f",
		"punctuation": "#292929",
		"inserted": "#024c1a",
		"deleted": "#a0111f",
		"changed": "#744500"
	}
}
