{
	"$schema": "../theme.schema.json",
	"schemaVersion": 2,
	"id": "minimal-dark",
	"label": "Minimal Dark",
	"order": 30,
	"appearance": "dark",
	"contrast": "normal",
	"colors": {
		"accent": "#f0efec",
		"accentHover": "#d9d8d3",
		"accentSolid": "#f0efec",
		"onAccent": "#151515",
		"bubbleAccent": "#c3c2b7",
		"background": "#151515",
		"header": "#151515",
		"content": "#151515",
		"sidebar": "#151515",
		"input": "#1a1a19",
		"elevated": "#20201f",
		"dialog": "#20201f",
		"hover": "#30302e",
		"border": "#2b2b29",
		"borderStrong": "#494944",
		"text": "#f0efec",
		"muted": "#c3c2b7",
		"hint": "#898781",
		"selection": "#6ac8ff26",
		"selectionForeground": null,
		"editorSelection": "#6ac8ff26",
		"editorSelectionForeground": null,
		"info": "#97c8eb",
		"success": "#96d2b0",
		"danger": "#f2a0ae",
		"dangerHover": "#d58d99",
		"onDanger": "#151515",
		"warning": "#e9c37b"
	},
	"ansi": {
		"black": "#000000",
		"red": "#cd3131",
		"green": "#0dbc79",
		"yellow": "#e5e510",
		"blue": "#2472c8",
		"magenta": "#bc3fbc",
		"cyan": "#11a8cd",
		"white": "#e5e5e5",
		"brightBlack": "#666666",
		"brightRed": "#f14c4c",
		"brightGreen": "#23d18b",
		"brightYellow": "#f5f543",
		"brightBlue": "#3b8eea",
		"brightMagenta": "#d670d6",
		"brightCyan": "#29b8db",
		"brightWhite": "#e5e5e5"
	},
	"syntax": {
		"foreground": "#e6edf3",
		"comment": "#8b949e",
		"commentDoc": "#8b949e",
		"keyword": "#ff7b72",
		"string": "#a5d6ff",
		"number": "#79c0ff",
		"regexp": "#a5d6ff",
		"annotation": "#d2a8ff",
		"tag": "#7ee787",
		"attributeName": "#79c0ff",
		"attributeValue": "#a5d6ff",
		"property": "#79c0ff",
		"function": "#d2a8ff",
		"type": "#ffa657",
		"variable": "#ffa657",
		"constant": "#79c0ff",
		"operator": "#ff7b72",
		"punctuation": "#e6edf3",
		"inserted": "#aff5b4",
		"deleted": "#ffdcd7",
		"changed": "#e3b341"
	}
}
