{
	"$schema": "../theme.schema.json",
	"schemaVersion": 2,
	"id": "high-contrast-dark",
	"label": "High Contrast Dark",
	"order": 50,
	"appearance": "dark",
	"contrast": "high",
	"colors": {
		"accent": "#ffffff",
		"accentHover": "#e0dfda",
		"accentSolid": "#ffffff",
		"onAccent": "#000000",
		"bubbleAccent": "#e0dfda",
		"background": "#000000",
		"header": "#0b0b0b",
		"content": "#000000",
		"sidebar": "#0b0b0b",
		"input": "#151515",
		"elevated": "#151515",
		"dialog": "#151515",
		"hover": "#282827",
		"border": "#6b6a64",
		"borderStrong": "#c3c2b7",
		"text": "#ffffff",
		"muted": "#e0dfda",
		"hint": "#aaa89e",
		"selection": "#f0efec",
		"selectionForeground": "#000000",
		"editorSelection": "#f0efec",
		"editorSelectionForeground": "#000000",
		"info": "#6ac8ff",
		"success": "#41cb66",
		"danger": "#ff4b75",
		"dangerHover": "#e04267",
		"onDanger": "#000000",
		"warning": "#ffd54b"
	},
	"ansi": {
		"black": "#000000",
		"red": "#cd3131",
		"green": "#0dbc79",
		"yellow": "#e5e510",
		"blue": "#2472c8",
		"magenta": "#bc3fbc",
		"cyan": "#11a8cd",
		"white": "#e5e5e5",
		"brightBlack": "#666666",
		"brightRed": "#f14c4c",
		"brightGreen": "#23d18b",
		"brightYellow": "#f5f543",
		"brightBlue": "#3b8eea",
		"brightMagenta": "#d670d6",
		"brightCyan": "#29b8db",
		"brightWhite": "#e5e5e5"
	},
	"syntax": {
		"foreground": "#ffffff",
		"comment": "#7ca668",
		"commentDoc": "#7ca668",
		"keyword": "#569cd6",
		"string": "#ce9178",
		"number": "#ffffff",
		"regexp": "#c0c0c0",
		"annotation": "#dcdcaa",
		"tag": "#569cd6",
		"attributeName": "#569cd6",
		"attributeValue": "#ce9178",
		"property": "#9cdcfe",
		"function": "#dcdcaa",
		"type": "#3dc9b0",
		"variable": "#1aebff",
		"constant": "#ffffff",
		"operator": "#d4d4d4",
		"punctuation": "#ffffff",
		"inserted": "#3ff23f",
		"deleted": "#f44747",
		"changed": "#569cd6"
	}
}
