{
	"$schema": "../theme.schema.json",
	"schemaVersion": 2,
	"id": "minimal-light",
	"label": "Minimal Light",
	"order": 40,
	"appearance": "light",
	"contrast": "normal",
	"colors": {
		"accent": "#0b0b0b",
		"accentHover": "#30302e",
		"accentSolid": "#0b0b0b",
		"onAccent": "#ffffff",
		"bubbleAccent": "#52514e",
		"background": "#f9f9f7",
		"header": "#f9f9f7",
		"content": "#f9f9f7",
		"sidebar": "#f9f9f7",
		"input": "#fcfcfb",
		"elevated": "#ffffff",
		"dialog": "#ffffff",
		"hover": "#e6e6e2",
		"border": "#e4e4df",
		"borderStrong": "#cdccc5",
		"text": "#0b0b0b",
		"muted": "#52514e",
		"hint": "#817f79",
		"selection": "#306bc433",
		"selectionForeground": null,
		"editorSelection": "#dbe7f8",
		"editorSelectionForeground": null,
		"info": "#286c9d",
		"success": "#16734d",
		"danger": "#b03645",
		"dangerHover": "#9b303d",
		"onDanger": "#ffffff",
		"warning": "#875810"
	},
	"ansi": {
		"black": "#000000",
		"red": "#cd3131",
		"green": "#00bc00",
		"yellow": "#949800",
		"blue": "#0451a5",
		"magenta": "#bc05bc",
		"cyan": "#0598bc",
		"white": "#555555",
		"brightBlack": "#666666",
		"brightRed": "#cd3131",
		"brightGreen": "#14ce14",
		"brightYellow": "#b5ba00",
		"brightBlue": "#0451a5",
		"brightMagenta": "#bc05bc",
		"brightCyan": "#0598bc",
		"brightWhite": "#a5a5a5"
	},
	"syntax": {
		"foreground": "#24292f",
		"comment": "#66717a",
		"commentDoc": "#66717a",
		"keyword": "#cf222e",
		"string": "#0a3069",
		"number": "#0550ae",
		"regexp": "#0a3069",
		"annotation": "#8250df",
		"tag": "#116329",
		"attributeName": "#0550ae",
		"attributeValue": "#0a3069",
		"property": "#0550ae",
		"function": "#8250df",
		"type": "#953800",
		"variable": "#953800",
		"constant": "#0550ae",
		"operator": "#cf222e",
		"punctuation": "#24292f",
		"inserted": "#116329",
		"deleted": "#cf222e",
		"changed": "#9a6700"
	}
}
